{
  "$schema": "https://json-schema.org/draft/2020-12/schema",
  "$id": "https://kinno.dev/schemas/sejong/king-sejong-context.schema.json",
  "title": "King Sejong Active Context Schema Draft",
  "description": "Runtime checkpoint contract for active King Sejong workflows.",
  "type": "object",
  "additionalProperties": false,
  "properties": {
    "format": {
      "const": "king-sejong.context/v0.1-draft"
    },
    "active_context_id": {
      "$ref": "#/$defs/NonEmptyString"
    },
    "repo_id": {
      "$ref": "#/$defs/NonEmptyString"
    },
    "repo_root": {
      "$ref": "#/$defs/NonEmptyString"
    },
    "repo_identities": {
      "description": "Exact Git common-directory or exact path identities authorized for this durable context.",
      "$ref": "#/$defs/StringList"
    },
    "context_status": {
      "type": "string",
      "enum": ["active", "paused", "completed", "closed"]
    },
    "context_revision": {
      "type": "integer",
      "minimum": 1
    },
    "run_id": {
      "$ref": "#/$defs/NonEmptyString"
    },
    "session_id": {
      "$ref": "#/$defs/NonEmptyString"
    },
    "route_id": {
      "$ref": "#/$defs/NonEmptyString"
    },
    "objective_id": {
      "description": "Optional product, workflow, or outcome objective id that survives repo/worktree migration.",
      "$ref": "#/$defs/NonEmptyString"
    },
    "objective_refs": {
      "description": "Optional refs to objective, wedge, design, or migration artifacts that define the current run.",
      "$ref": "#/$defs/StringList"
    },
    "task_class": {
      "description": "Optional long-session task class used for class-specific continuation and promotion checks.",
      "$ref": "#/$defs/NonEmptyString"
    },
    "projection_profile": {
      "description": "Optional default continuity projection profile for hook-injected model context.",
      "$ref": "#/$defs/ProjectionProfile"
    },
    "current_surface": {
      "$ref": "#/$defs/Surface"
    },
    "route_sequence": {
      "$ref": "#/$defs/StringList"
    },
    "required_route_sequence": {
      "$ref": "#/$defs/StringList"
    },
    "last_user_intent": {
      "$ref": "#/$defs/NonEmptyString"
    },
    "pending_gates": {
      "description": "Open workflow gates. Use uigwe_promotion_required only when a material intent, design, acceptance, or handoff boundary remains unresolved, or formal Uigwe planning was explicitly requested, and the required Uigwe pass for that boundary has not started. Use seungjeongwon_receipt_required when goal-bearing execution requires a Seungjeongwon receipt before write-like execution.",
      "$ref": "#/$defs/StringList"
    },
    "protected_paths": {
      "$ref": "#/$defs/StringList"
    },
    "allowed_direct_change_types": {
      "$ref": "#/$defs/StringList"
    },
    "evidence_refs": {
      "$ref": "#/$defs/StringList"
    },
    "artifact_refs": {
      "$ref": "#/$defs/StringList"
    },
    "team_run_refs": {
      "$ref": "#/$defs/StringList"
    },
    "subagent_refs": {
      "$ref": "#/$defs/StringList"
    },
    "exit_conditions": {
      "$ref": "#/$defs/StringList"
    },
    "last_updated_at": {
      "type": "string",
      "format": "date-time"
    }
  },
  "required": [
    "format",
    "active_context_id",
    "repo_id",
    "repo_root",
    "run_id",
    "session_id",
    "route_id",
    "current_surface",
    "route_sequence",
    "required_route_sequence",
    "last_user_intent",
    "pending_gates",
    "protected_paths",
    "allowed_direct_change_types",
    "evidence_refs",
    "artifact_refs",
    "team_run_refs",
    "subagent_refs",
    "exit_conditions",
    "last_updated_at"
  ],
  "$defs": {
    "NonEmptyString": {
      "type": "string",
      "minLength": 1
    },
    "StringList": {
      "type": "array",
      "items": {
        "$ref": "#/$defs/NonEmptyString"
      }
    },
    "Surface": {
      "type": "string",
      "enum": [
        "sejong",
        "jangyeongsil",
        "jiphyeonjeon",
        "uigwe",
        "seungjeongwon",
        "sillok",
        "danjong",
        "sejong-direct"
      ]
    },
    "ProjectionProfile": {
      "type": "string",
      "enum": [
        "micro",
        "standard",
        "frontier",
        "retrieval"
      ]
    }
  }
}
